{
  "slug": "conductor-pipeline",
  "category": "pipeline",
  "title": "Conductor Pipeline",
  "description": "Autonomous ticket-to-PR workflow — from GitHub issue through planning, implementation, review, and pull request creation.",
  "layers": [
    {
      "id": "input",
      "label": "Input",
      "color": "#78756f",
      "nodes": [
        {
          "id": "ticket",
          "label": "/conductor start #N",
          "tooltip": "Developer triggers the conductor with a GitHub issue number. The conductor reads the issue, loads context, and begins the autonomous workflow."
        }
      ]
    },
    {
      "id": "planning",
      "label": "Planning",
      "color": "#58a6ff",
      "nodes": [
        {
          "id": "plan-architect",
          "label": "plan-architect",
          "sublabel": "Opus model",
          "tooltip": "Reads the GitHub issue, analyzes the codebase, and generates a phased implementation plan with discrete tasks. Uses Opus for maximum reasoning depth."
        }
      ]
    },
    {
      "id": "implementation",
      "label": "Implementation",
      "color": "#3dbe87",
      "nodes": [
        {
          "id": "task-executor",
          "label": "task-executor",
          "sublabel": "Sonnet model",
          "tooltip": "Implements individual tasks from the plan. Expert skills are pre-loaded per task. Loops through all tasks in each phase."
        },
        {
          "id": "phase-verifier",
          "label": "phase-verifier",
          "sublabel": "Sonnet model",
          "tooltip": "Verifies each phase is complete and correct before advancing to the next. Runs quality checks at phase boundaries."
        }
      ]
    },
    {
      "id": "review",
      "label": "Review",
      "color": "#d2a8ff",
      "nodes": [
        {
          "id": "review-orchestrator",
          "label": "review-orchestrator",
          "sublabel": "Sonnet model",
          "tooltip": "Runs /preflight, /ui-test, and /a11y-audit quality gates. Produces review findings."
        },
        {
          "id": "finding-resolver",
          "label": "finding-resolver",
          "sublabel": "Sonnet model",
          "tooltip": "Creates atomic fix tasks from review findings and feeds them back to task-executor for remediation."
        }
      ]
    },
    {
      "id": "escalation",
      "label": "Escalation",
      "color": "#e27739",
      "nodes": [
        {
          "id": "debug-investigator",
          "label": "debug-investigator",
          "sublabel": "Opus model",
          "tooltip": "Deep 7-step investigation for tasks that fail 3 times. Uses Opus for maximum reasoning depth. Escalates to human via GitHub if still blocked."
        }
      ]
    },
    {
      "id": "output",
      "label": "Output",
      "color": "#3dbe87",
      "nodes": [
        {
          "id": "pr-creator",
          "label": "pr-creator",
          "sublabel": "Sonnet model",
          "tooltip": "Creates the pull request with structured description, links to the GitHub issue, and moves the ticket on the kanban board."
        }
      ]
    }
  ],
  "connections": [
    { "from": "ticket", "to": "plan-architect", "label": "Start" },
    { "from": "plan-architect", "to": "task-executor", "label": "Plan ready" },
    { "from": "task-executor", "to": "phase-verifier", "label": "Phase complete" },
    { "from": "phase-verifier", "to": "task-executor", "label": "Next phase" },
    { "from": "phase-verifier", "to": "review-orchestrator", "label": "All phases done" },
    { "from": "review-orchestrator", "to": "pr-creator", "label": "Clean" },
    { "from": "review-orchestrator", "to": "finding-resolver", "label": "Needs fixes" },
    { "from": "finding-resolver", "to": "task-executor", "label": "Fix tasks" },
    { "from": "task-executor", "to": "debug-investigator", "label": "3rd failure" },
    { "from": "debug-investigator", "to": "task-executor", "label": "One more attempt" },
    { "from": "pr-creator", "to": "ticket", "label": "PR opened", "style": "dashed" }
  ]
}
